{
  "client_name": "My Example Client",
  "grant_types": ["authorization_code", "refresh_token"],
  "redirect_uris": [
    "https://client.example.org/callback",
    "https://client.example.org/callback2"
  ],
  "response_types": ["code"],
  "scope": "query connection",
  "token_endpoint_auth_method": "client_secret_basic"
}